{
  "$schema": "https://json-schema.org/draft/2020-12/schema",
  "$id": "https://laplace.dev/schemas/config.schema.json",
  "title": "Laplace warehouse config (Contract A)",
  "description": "Complete specification of one simulated warehouse. CONVENTIONS: distances in meters, times in minutes, rates per minute, speeds in m/s. Node naming: 'A{aisle}_{position}' where aisle is 1-indexed and position is integer meters along the aisle (e.g. 'A3_15'). Edge naming: '{from_node}->{to_node}'. All randomness in a rollout derives from the run seed, NOT from this config. A config plus a seed fully determines a trajectory.",
  "type": "object",
  "required": ["schema_version", "scenario_id", "layout", "stations", "fleet", "demand", "horizon"],
  "additionalProperties": false,
  "properties": {
    "schema_version": { "const": "1.0" },
    "scenario_id": { "type": "string", "pattern": "^[a-z0-9_]{3,40}$" },

    "layout": {
      "type": "object",
      "required": ["grid"],
      "additionalProperties": false,
      "properties": {
        "grid": {
          "type": "object",
          "description": "Base topology: parallel aisles connected by cross-aisles. Generated nodes sit at 1 m intervals along each aisle; cross-aisles connect equal positions across all aisles.",
          "required": ["aisles", "aisle_length_m", "cross_aisles"],
          "additionalProperties": false,
          "properties": {
            "aisles": { "type": "integer", "minimum": 2, "maximum": 10 },
            "aisle_length_m": { "type": "integer", "minimum": 10, "maximum": 60 },
            "aisle_spacing_m": {
              "type": "number", "minimum": 1.0, "maximum": 20.0,
              "description": "Center-to-center distance (m) between adjacent aisles. Sets the LENGTH of cross-aisle and extra edges and the node x-coordinates (nodes still sit at 1 m intervals ALONG each aisle). OPTIONAL: when omitted the simulator uses its 3.0 m convention. Set from a scanned real footprint (facility/usd_extractor) to make cross-aisle travel time, battery drain, routing, and congestion geometrically faithful. Intentionally NOT default-filled: omitting it keeps a config byte-identical (and hash-identical) to the pre-field canonical form."
            },
            "cross_aisles": {
              "type": "array",
              "description": "Positions (meters along aisle) where cross-aisles exist. Must include both ends in most scenarios.",
              "items": { "type": "integer", "minimum": 0, "maximum": 60 },
              "minItems": 1, "maxItems": 6, "uniqueItems": true
            }
          }
        },
        "extra_edges": {
          "type": "array",
          "description": "Edges added beyond the grid (e.g. a shortcut). THIS IS THE BRAESS LEVER.",
          "default": [],
          "maxItems": 8,
          "items": {
            "type": "object",
            "required": ["from", "to"],
            "additionalProperties": false,
            "properties": {
              "from": { "$ref": "#/$defs/node_id" },
              "to": { "$ref": "#/$defs/node_id" },
              "bidirectional": { "type": "boolean", "default": true }
            }
          }
        },
        "edge_overrides": {
          "type": "array",
          "description": "Per-edge capacity / direction / speed overrides. Default edge: capacity 2, bidirectional, max_speed = fleet speed.",
          "default": [],
          "maxItems": 16,
          "items": {
            "type": "object",
            "required": ["edge"],
            "additionalProperties": false,
            "properties": {
              "edge": { "$ref": "#/$defs/edge_id" },
              "capacity": { "type": "integer", "minimum": 1, "maximum": 6, "description": "Max simultaneous AMRs on the edge; entrants beyond capacity queue at the tail node." },
              "one_way": { "type": "boolean", "default": false, "description": "If true, traversal allowed only in the edge's stated from->to direction." },
              "max_speed_mps": { "type": "number", "minimum": 0.2, "maximum": 3.0 }
            }
          }
        }
      }
    },

    "stations": {
      "type": "object",
      "required": ["pick", "pack", "charge", "dock"],
      "additionalProperties": false,
      "properties": {
        "pick":   { "type": "array", "minItems": 1, "maxItems": 8, "items": { "$ref": "#/$defs/service_station" } },
        "pack":   { "type": "array", "minItems": 1, "maxItems": 6, "items": { "$ref": "#/$defs/service_station" } },
        "charge": { "type": "array", "minItems": 1, "maxItems": 4, "items": { "$ref": "#/$defs/slot_station" } },
        "dock":   { "type": "array", "minItems": 1, "maxItems": 2, "items": { "$ref": "#/$defs/point_station" } }
      }
    },

    "fleet": {
      "type": "object",
      "required": ["amr_count"],
      "additionalProperties": false,
      "properties": {
        "amr_count": { "type": "integer", "minimum": 1, "maximum": 12 },
        "speed_mps": { "type": "number", "minimum": 0.5, "maximum": 3.0, "default": 1.5 },
        "battery_capacity_m": { "type": "integer", "minimum": 1000, "maximum": 20000, "default": 4000, "description": "Meters of travel per full charge. AMR seeks charge below 15% remaining; charging restores full capacity in charge_minutes." },
        "charge_minutes": { "type": "number", "minimum": 1, "maximum": 60, "default": 20 },
        "routing": { "enum": ["shortest_path", "congestion_aware"], "default": "shortest_path", "description": "congestion_aware: edge cost = length * (1 + congestion_penalty * current_occupancy/capacity); congestion_penalty defaults to 2.0 (see below)." },
        "dispatch": { "enum": ["nearest_idle", "atc", "covert"], "description": "Task-allocation rule (which idle AMR gets the next order). OPTIONAL and intentionally NOT default-filled: omitting it keeps a config byte-identical (hash-identical) and the simulator uses the frozen-v1 'nearest_idle'. Agent-controllable (policy SELECTION only; objective weights stay scenario-fixed). atc/covert are composite dispatching rules; deterministic, no added randomness." },
        "congestion_penalty": { "type": "number", "minimum": 0.0, "maximum": 5.0, "description": "Edge-cost congestion multiplier for routing=='congestion_aware'. OPTIONAL, NOT default-filled; absent -> 2.0 (the frozen-v1 constant), preserving config_hash." },
        "charge_threshold_pct": { "type": "number", "minimum": 0.05, "maximum": 0.5, "description": "Battery fraction below which an idle AMR seeks charge. OPTIONAL, NOT default-filled; absent -> 0.15 (the frozen-v1 constant), preserving config_hash." }
      }
    },

    "demand": {
      "type": "object",
      "required": ["arrival_rate_per_min"],
      "additionalProperties": false,
      "properties": {
        "arrival_rate_per_min": { "type": "number", "minimum": 0.5, "maximum": 8.0, "description": "Poisson order arrivals. Each order: pick at uniformly random pick station -> deliver to a pack station per pack_assignment." },
        "pack_assignment": { "enum": ["round_robin", "shortest_queue"], "default": "round_robin" }
      }
    },

    "horizon": {
      "type": "object",
      "additionalProperties": false,
      "properties": {
        "sim_minutes": { "type": "integer", "minimum": 60, "maximum": 1440, "default": 480 },
        "warmup_minutes": { "type": "integer", "minimum": 0, "maximum": 120, "default": 30, "description": "Events before warmup end are simulated but EXCLUDED from all metrics." }
      }
    }
  },

  "$defs": {
    "node_id": { "type": "string", "pattern": "^A[0-9]{1,2}_[0-9]{1,2}$" },
    "edge_id": { "type": "string", "pattern": "^A[0-9]{1,2}_[0-9]{1,2}->A[0-9]{1,2}_[0-9]{1,2}$" },
    "service_station": {
      "type": "object",
      "required": ["id", "node", "slots", "service_lognorm"],
      "additionalProperties": false,
      "properties": {
        "id": { "type": "string", "pattern": "^[A-Z][0-9]{1,2}$" },
        "node": { "$ref": "#/$defs/node_id" },
        "slots": { "type": "integer", "minimum": 1, "maximum": 4, "description": "Parallel service slots; AMRs beyond slots queue FIFO at the node." },
        "service_lognorm": {
          "type": "array", "prefixItems": [{ "type": "number" }, { "type": "number", "minimum": 0.05, "maximum": 1.5 }],
          "minItems": 2, "maxItems": 2,
          "description": "[mu, sigma] of ln(service_minutes). Mean service time = exp(mu + sigma^2/2). THE VARIANCE-TRAP LEVER."
        }
      }
    },
    "slot_station": {
      "type": "object",
      "required": ["id", "node", "slots"],
      "additionalProperties": false,
      "properties": {
        "id": { "type": "string", "pattern": "^[A-Z][0-9]{1,2}$" },
        "node": { "$ref": "#/$defs/node_id" },
        "slots": { "type": "integer", "minimum": 1, "maximum": 4 }
      }
    },
    "point_station": {
      "type": "object",
      "required": ["id", "node"],
      "additionalProperties": false,
      "properties": {
        "id": { "type": "string", "pattern": "^[A-Z][0-9]{1,2}$" },
        "node": { "$ref": "#/$defs/node_id" }
      }
    }
  }
}
